{
  "blocked_claims": [],
  "created_at": "2026-05-21T19:06:41.552928Z",
  "draft_id": "draft_evt_d9aa38bdc636459c92ea4e25f665cd0d_alert_draft",
  "draft_text": "CareSight recorded a possible event (possible_floor_stay) in Living Room. Status is human confirmed. Snapshot path: apps/caresight-hub/data/snapshots/evt_d9aa38bdc636459c92ea4e25f665cd0d.jpg. Please review the local CareSight record before taking action.",
  "event_id": "evt_d9aa38bdc636459c92ea4e25f665cd0d",
  "provenance": {
    "source": "sqlite_audit_chain",
    "source_fields": [
      "events",
      "event_observations",
      "event_reviews",
      "journal_entries",
      "agent_handoffs"
    ]
  },
  "provider": "fake",
  "purpose": "alert_draft",
  "safe_rewrite": null,
  "safety_boundaries": [
    "draft_only",
    "human_review_required",
    "sqlite_canonical",
    "no_autonomous_dispatch",
    "no_medical_diagnosis",
    "no_medication_confirmation",
    "no_hipaa_claim"
  ],
  "schema": "agent-draft",
  "source_of_truth": "sqlite",
  "validation_status": "validated"
}
